<?xml version="1.0" encoding="UTF-8"?>
<!DOCTYPE colegio SYSTEM "EJ2.dtd">
<colegio>
    <nombredirector>Pedro</nombredirector>
    <curso>
        <nivel>Primero</nivel>
        <tutor>Paco</tutor>
        <delegado>David</delegado>
        <alumno>Marco</alumno>
        <edad>13</edad>
    </curso>
</colegio>